{
  "$schema": "http://json-schema.org/draft-04/schema#",
  "title": "Source",
  "description": "An OpenAddresses source",
  "type": "object",
  "required": [
    "type",
    "data",
    "coverage"
  ],
  "additionalProperties": false,
  "properties": {
    "type": {
      "type": "string",
      "enum": [
        "http",
        "ftp",
        "ESRI"
      ]
    },
    "data": {
      "type": "string"
    },
    "coverage": {
      "$ref": "#/definitions/coverage"
    },
    "website": {
      "type": "string"
    },
    "email": {
      "type": "string",
      "format": "email"
    },
    "conform": {
      "$ref": "#/definitions/conform"
    },
    "compression": {
      "type": "string",
      "enum": ["zip"]
    },
    "license": {
      "oneOf": [
        { "type": "string" },
        { "$ref": "#/definitions/license" }
      ]
    },
    "note": {
      "oneOf": [
        { "type": "string" },
        { "type": "object" }
      ]
    },
    "attribution": {
      "type": "string"
    },
    "language": {
      "type": "string",
      "pattern": "^[a-zA-Z]{2}$"
    },
    "year": {
      "oneOf": [
        { "type": "string" },
        { "type": "integer" }
      ]
    },
    "skip": {
      "type": "boolean"
    },
    "test": {
      "$ref": "#/definitions/test"
    }
  },
  "definitions": {
    "coverage": {
      "type": "object",
      "required": [
        "country"
      ],
      "properties": {
        "country": {
          "type": "string"
        },
        "province": {
          "type": "string"
        },
        "state": {
          "type": "string"
        },
        "county": {
          "type": "string"
        },
        "city": {
          "type": "string"
        },
        "geometry": {
          "$ref": "http://json.schemastore.org/geojson#/definitions/geometry"
        }
      }
    },
    "license": {
      "type": "object",
      "properties": {
        "url": {
          "type": "string",
          "format": "uri"
        },
        "text": {
          "type": "string"
        },
        "attribution": {
          "type": "boolean"
        },
        "attribution name": {
          "type": "string"
        },
        "share-alike": {
          "type": "boolean"
        }
      }
    },
    "base_conform_field_value": {
      "description": "convenience definition for one of null, string, or string array",
      "oneOf": [
        { "type": "null" },
        { "type": "string" },
        {
          "type": "array",
          "minItems": 1,
          "items": { "type": "string" }
        }
      ]
    },
    "conform": {
      "description": "top-level conform object definition",
      "type": "object",
      "required": ["number", "street"],
      "additionalProperties": false,
      "properties": {
        "type": {
          "type": "string",
          "enum": [
            "geojson",
            "shapefile",
            "shapefile-polygon",
            "gdb",
            "xml",
            "csv"
          ]
        },
        "addrtype": {
          "type": "string"
        },
        "accuracy": {
          "description": "https://github.com/openaddresses/openaddresses/blob/master/CONTRIBUTING.md#accuracy",
          "type": "integer",
          "minimum": 0,
          "maximum": 5,
          "exclusiveMinimum": true
        },
        "srs": {
          "type": "string",
          "regex": "EPSG:[0-9]+"
        },
        "file": {
          "type": "string"
        },
        "layer": {
          "description": "specifies a layer to use in the GDB",
          "oneOf": [
            { "type": "integer" },
            { "type": "string" }
          ]
        },
        "encoding": {
          "type": "string"
        },
        "csvsplit": {
          "type": "string"
        },
        "headers": {
          "type": "integer",
          "minimum": -1
        },
        "skiplines": {
          "type": "integer",
          "minimum": 1
        },
        "notes": {
          "type": "string"
        },
        "id": {
          "description": "unique identifier for the address row",
          "oneOf": [
            { "$ref": "#/definitions/base_conform_field_value" },
            { "$ref": "#/definitions/function_regexp" },
            { "$ref": "#/definitions/function_remove_prefix" },
            { "$ref": "#/definitions/function_remove_postfix" },
            { "$ref": "#/definitions/function_join" },
            { "$ref": "#/definitions/function_format" }
          ]
        },
        "number": {
          "description": "the house number for the address row",
          "oneOf": [
            { "$ref": "#/definitions/base_conform_field_value" },
            { "$ref": "#/definitions/function_regexp" },
            { "$ref": "#/definitions/function_prefixed_number" },
            { "$ref": "#/definitions/function_remove_prefix" },
            { "$ref": "#/definitions/function_remove_postfix" },
            { "$ref": "#/definitions/function_join" },
            { "$ref": "#/definitions/function_format" }
          ]
        },
        "street": {
          "description": "the street/road for the address row",
          "oneOf": [
            { "$ref": "#/definitions/base_conform_field_value" },
            { "$ref": "#/definitions/function_regexp" },
            { "$ref": "#/definitions/function_postfixed_street" },
            { "$ref": "#/definitions/function_remove_prefix" },
            { "$ref": "#/definitions/function_remove_postfix" },
            { "$ref": "#/definitions/function_join" },
            { "$ref": "#/definitions/function_format" }
          ]
        },
        "unit": {
          "description": "the suite/unit/apartment for the address row",
          "oneOf": [
            { "$ref": "#/definitions/base_conform_field_value" },
            { "$ref": "#/definitions/function_regexp" },
            { "$ref": "#/definitions/function_remove_prefix" },
            { "$ref": "#/definitions/function_remove_postfix" },
            { "$ref": "#/definitions/function_join" },
            { "$ref": "#/definitions/function_format" }
          ]
        },
        "city": {
          "description": "the city/locality for the address row",
          "oneOf": [
            { "$ref": "#/definitions/base_conform_field_value" },
            { "$ref": "#/definitions/function_regexp" },
            { "$ref": "#/definitions/function_remove_prefix" },
            { "$ref": "#/definitions/function_remove_postfix" },
            { "$ref": "#/definitions/function_join" },
            { "$ref": "#/definitions/function_format" }
          ]
        },
        "district": {
          "description": "the county for the address row",
          "oneOf": [
            { "$ref": "#/definitions/base_conform_field_value" },
            { "$ref": "#/definitions/function_regexp" },
            { "$ref": "#/definitions/function_remove_prefix" },
            { "$ref": "#/definitions/function_remove_postfix" },
            { "$ref": "#/definitions/function_join" },
            { "$ref": "#/definitions/function_format" }
          ]
        },
        "region": {
          "description": "the state/province for the address row",
          "oneOf": [
            { "$ref": "#/definitions/base_conform_field_value" },
            { "$ref": "#/definitions/function_regexp" },
            { "$ref": "#/definitions/function_remove_prefix" },
            { "$ref": "#/definitions/function_remove_postfix" },
            { "$ref": "#/definitions/function_join" },
            { "$ref": "#/definitions/function_format" }
          ]
        },
        "postcode": {
          "description": "the postcode for the address row",
          "oneOf": [
            { "$ref": "#/definitions/base_conform_field_value" },
            { "$ref": "#/definitions/function_regexp" },
            { "$ref": "#/definitions/function_remove_prefix" },
            { "$ref": "#/definitions/function_remove_postfix" },
            { "$ref": "#/definitions/function_join" },
            { "$ref": "#/definitions/function_format" }
          ]
        },
        "lon": {
          "description": "longitude value for the address row, only applies to CSV sources",
          "oneOf": [
            { "type": "null" },
            { "type": "string" },
            { "$ref": "#/definitions/function_regexp" }
          ]
        },
        "lat": {
          "description": "latitude value for the address row, only applies to CSV sources",
          "oneOf": [
            { "type": "null" },
            { "type": "string" },
            { "$ref": "#/definitions/function_regexp" }
          ]
        }
      }
    },
    "test": {
      "description": "test definition",
      "type": "object",
      "required": ["description"],
      "additionalProperties": false,
      "properties": {
        "enabled": {
          "type": "boolean"
        },
        "description": {
          "type": "string"
        },
        "acceptance-tests": {
          "type": "array",
          "minItems": 1,
          "items": { "$ref": "#/definitions/acceptance-test" }
        }
      }
    },
    "acceptance-test": {
      "description": "acceptance-test definition",
      "type": "object",
      "required": ["description", "inputs", "expected"],
      "additionalProperties": false,
      "properties": {
        "description": {
          "type": "string"
        },
        "inputs": {
          "type": "object"
        },
        "expected": {
          "type": "object"
        }
      }
    },
    "function_regexp": {
      "description": "regexp function definition",
      "type": "object",
      "required": ["function", "field", "pattern"],
      "additionalProperties": false,
      "properties": {
        "function": {
          "type": "string",
          "enum": ["regexp"]
        },
        "field": {
          "type": "string"
        },
        "pattern": {
          "type": "string",
          "format": "string"
        },
        "replace": {
          "type": "string"
        }
      }
    },
    "function_prefixed_number": {
      "description": "prefixed_number function definition",
      "type": "object",
      "required": ["function", "field"],
      "additionalProperties": false,
      "properties": {
        "function": {
          "type": "string",
          "enum": ["prefixed_number"]
        },
        "field": {
          "type": "string"
        }
      }
    },
    "function_postfixed_street": {
      "description": "postfixed_street function definition",
      "type": "object",
      "required": ["function", "field"],
      "additionalProperties": false,
      "properties": {
        "function": {
          "type": "string",
          "enum": ["postfixed_street"]
        },
        "field": {
          "type": "string"
        }
      }
    },
    "function_remove_prefix": {
      "description": "remove_prefix function definition",
      "type": "object",
      "required": ["function", "field", "field_to_remove"],
      "additionalProperties": false,
      "properties": {
        "function": {
          "type": "string",
          "enum": ["remove_prefix"]
        },
        "field": {
          "type": "string"
        },
        "field_to_remove": {
          "type": "string"
        }
      }
    },
    "function_remove_postfix": {
      "description": "remove_postfix function definition",
      "type": "object",
      "required": ["function", "field", "field_to_remove"],
      "additionalProperties": false,
      "properties": {
        "function": {
          "type": "string",
          "enum": ["remove_postfix"]
        },
        "field": {
          "type": "string"
        },
        "field_to_remove": {
          "type": "string"
        }
      }
    },
    "function_join": {
      "description": "join function definition",
      "type": "object",
      "required": ["function", "fields"],
      "additionalProperties": false,
      "properties": {
        "function": {
          "type": "string",
          "enum": ["join"]
        },
        "fields": {
          "type": "array",
          "minItems": 1,
          "items": { "type": "string" }
        },
        "separator": {
          "type": "string"
        }
      }
    },
    "function_format": {
      "description": "format function definition",
      "type": "object",
      "required": ["function", "fields", "format"],
      "additionalProperties": false,
      "properties": {
        "function": {
          "type": "string",
          "enum": ["format"]
        },
        "fields": {
          "type": "array",
          "minItems": 1,
          "items": { "type": "string" }
        },
        "format": {
          "type": "string"
        }
      }
    }
  }
}
