{
    "coverage": {
        "US Census": {
            "geoid": "06041",
            "name": "Marin County",
            "state": "California"
        },
        "country": "us",
        "state": "ca",
        "county": "Marin"
    },
    "attribution": "Marlin County",
    "data": "http://gis.marinpublic.com/arcgis/rest/services/BaseMap/DistrictService/MapServer/0",
    "type": "ESRI",
    "conform": {
        "lon": "x",
        "lat": "y",
        "number": "number",
        "street": [
            "PreDir",
            "street",
            "suffix",
            "PostDir"
        ],
        "type": "csv",
        "postcode": "zipcode"
    }
}