{
    "coverage": {
        "US Census": {
            "geoid": "31143",
            "name": "Polk County",
            "state": "Nebraska"
        },
        "country": "us",
        "state": "ne",
        "county": "Polk"
    },
    "data": "http://maps6.gisworkshop.com/ArcGIS/rest/services/Polk/MapServer/1",
    "type": "ESRI",
    "conform": {
        "type": "geojson",
        "number": {
            "function": "regexp",
            "field": "PROPADDRESS",
            "pattern": "^([0-9]+)"
        },
        "street": {
            "function": "regexp",
            "field": "PROPADDRESS",
            "pattern": "^(?:[0-9]+ )(.*)",
            "replace": "$1"
        }
    }
}
