{
    "coverage": {
        "US Census": {
            "geoid": "12021",
            "name": "Collier County",
            "state": "Florida"
        },
        "country": "us",
        "state": "fl",
        "county": "Collier"
    },
    "attribution": "Collier County",
    "data": "https://apps3.colliergov.net/downloads/siteaddresspoint.zip",
    "website": "http://www.colliergov.net/Index.aspx?page=2713",
    "license": "Public Domain",
    "type": "http",
    "compression": "zip",
    "conform": {
        "type": "shapefile",
        "lon": "x",
        "lat": "y",
        "number": "ADDRNUM",
        "street": "FULLNAME",
        "city": "MUNICIPALI"
    }
}
