{
    "coverage": {
        "US Census": {
            "geoid": "53045",
            "name": "Mason County",
            "state": "Washington"
        },
        "country": "us",
        "state": "wa",
        "county": "Mason"
    },
    "license": "http://www.co.mason.wa.us/gis/disclaimer.php",
    "type": "ESRI",
    "compression": "zip",
    "note": "point shapefile Site_Address.shp, address columns: ADDRESS, ZIP_CD",
    "year": "2014",
    "data": "http://www.arcgis.com/home/item.html?id=986434ffd63b4c7ba618953d5e049ae9",
    "website": "http://www.co.mason.wa.us/gis/"
}