{
    "coverage": {
        "US Census": {
            "geoid": "48085",
            "name": "Collin County",
            "state": "Texas"
        },
        "country": "us",
        "state": "tx",
        "county": "Collin"
    },
    "data": "http://gismaps.collincountytx.gov/ArcGIS/rest/services/dynamic/AddressPoints/MapServer/0",
    "type": "ESRI",
    "conform": {
        "type": "geojson",
        "street": [
            "ADD_PRE",
            "ADD_NAME",
            "ADD_TYPE",
            "ADD_SUF"
        ],
        "number": "ADD_NUMBER"
    }
}
