{
    "coverage": {
        "US Census": {
            "geoid": "29009",
            "name": "Barry County",
            "state": "Missouri"
        },
        "country": "us",
        "state": "mo",
        "county": "Barry"
    },
    "data": "http://gis-server.greatriv.com/ArcGIS/rest/services/BarryCo/BarryCo_operational/MapServer/2",
    "type": "ESRI",
    "conform": {
        "lon": "x",
        "lat": "y",
        "number": "address",
        "street": "roadname",
        "type": "geojson"
    }
}