{
    "coverage": {
        "country": "ca",
        "state": "ab",
        "city": "Chestermere",
        "geometry": { "type": "Point", "coordinates": [-113.853, 51.030] }
    },
    "data": "https://services3.arcgis.com/8FWoKvthx3zWyrPO/ArcGIS/rest/services/Chestermere_Address_Points/FeatureServer/0",
    "type": "ESRI",
    "conform": {
        "type": "geojson",
        "id": "FID",
        "number": "ADDRESS_HO",
        "unit": "ADDRESS_AP",
        "street": "ADDRESS_ST"
    }
}
