{
    "coverage": {
        "US Census": {"geoid": "48139", "name": "Ellis County", "state": "Texas"},
        "country": "us",
        "state": "tx",
        "county": "Ellis"
    },
    "data": "http://mapsatbis.com/bisgis/rest/services/EllisWeb/MapServer/0",
    "type": "ESRI",
    "conform": {
        "number": "EllisCad.DBO.Accounts.situs_num",
        "street": [
            "EllisCad.DBO.Accounts.situs_street_prefx",
            "EllisCad.DBO.Accounts.situs_street",
            "EllisCad.DBO.Accounts.situs_street_sufix"
        ],
        "city": "EllisCad.DBO.Accounts.situs_city",
        "region": "EllisCad.DBO.Accounts.situs_state",
        "postcode": "EllisCad.DBO.Accounts.situs_zip",
        "type": "geojson"
    }
}
