{
    "coverage": {
        "US Census": {
            "geoid": "08101",
            "name": "Pueblo County",
            "state": "Colorado"
        },
        "country": "us",
        "state": "co",
        "county": "Pueblo"
    },
    "attribution": "Pubelo County",
    "data": "http://maps.co.pueblo.co.us/outside/rest/services/pueblo_county_address_points/MapServer/0",
    "type": "ESRI",
    "conform": {
        "type": "csv",
        "lon": "x",
        "lat": "y",
        "number": "ADDRNUM",
        "street": "STNAME",
        "postcode": "ZIP",
        "city": "CITY",
        "region": "STATE",
        "accuracy": 1
    }
}