{
  "coverage": {
    "US Census": {
      "geoid": "19187",
      "name": "Webster County",
      "state": "Iowa"
    },
    "country": "us",
    "state": "ia",
    "county": "Webster"
  },
  "data": "ftp://ftp.igsb.uiowa.edu/gis_library/counties/Webster/Address_94.zip",
  "license": {
    "text": "Public Domain",
    "attribution": false,
    "share-alike": false
  },
  "year": "2012?",
  "type": "ftp",
  "compression": "zip",
  "conform": {
    "number": {
      "function": "regexp",
      "field": "address",
      "pattern": "^([0-9]+)"
    },
    "street": {
      "function": "regexp",
      "field": "address",
      "pattern": "^(?:[0-9]+ )(.*)",
      "replace": "$1"
    },
    "type": "shapefile"
  }
}