{
    "coverage": {
        "US Census": {"geoid": "44", "state": "Rhode Island"},
        "country": "us",
        "state": "ri"
    },
    "website": "http://www.edc.uri.edu/rigis/data/data.aspx?ISO=structure",
    "data": "http://www.edc.uri.edu/rigis/spfdata/structure/e911Sites15r1.zip",
    "license": "http://www.edc.uri.edu/rigis/license.html",
    "type": "http",
    "compression": "zip",
    "conform": {
        "type": "shapefile",
        "lon": "x",
        "lat": "y",
        "number": "HouseNumbe",
        "street": "PrimaryNam",
        "city": "ZN",
        "postcode": "Zip"
    }
}
