{
    "coverage": {
        "US Census": {
            "geoid": "20193",
            "name": "Thomas County",
            "state": "Kansas"
        },
        "country": "us",
        "state": "ks",
        "county": "Thomas"
    },
    "conform": {
        "type": "csv",
        "number": "add_",
        "street": "street",
        "postcode": "zip",
        "lon": "x",
        "lat": "y"
    },
    "data": "http://72.205.198.131/ArcGIS/rest/services/Thomas/Thomas/MapServer/30",
    "type": "ESRI"
}