{
    "coverage": {
        "US Census": {
            "geoid": "01125",
            "name": "Tuscaloosa County",
            "state": "Alabama"
        },
        "country": "us",
        "state": "al",
        "county": "Tuscaloosa"
    },
    "type": "ESRI",
    "data": "http://services1.arcgis.com/DADyRNMb7tdzKmmq/arcgis/rest/services/Addresses/FeatureServer/0",
    "conform": {
        "type": "csv",
        "lat": "OA:y",
        "lon": "OA:x",
        "number": "HNUM",
        "street": "STREET",
        "city": "POSTAL_CIT",
        "postcode": "ZIP"
    }
}