{
    "coverage": {
        "US Census": {"geoid": "09", "state": "Connecticut"},
        "country": "us",
        "state": "ct"
    },
    "conform": {
        "type": "csv",
        "number": "CompleteAddressNumber",
        "street": "CompleteStreetName",
        "postcode": "ZipCode",
        "city": "Municipal_PlaceName",
        "region": "County_PlaceName",
        "lon": "OA:x",
        "lat": "OA:y"
    },
    "data": "http://www.ctgismaps2.ct.gov/arcgis/rest/services/CT_Open_Maps/Address_Points/MapServer/0",
    "type": "ESRI"
}
