{
    "coverage": {
        "country": "us",
        "state": "tx",
        "city": "Keller"
    },
    "data": "http://gis.dfwmaps.com/ArcGIS/rest/services/Keller/Keller_All_VE/MapServer/13",
    "type": "ESRI",
    "conform": {
        "lon": "x",
        "lat": "y",
        "number": "STREETNUMB",
        "street": [
            "STREETNAME",
            "STREETTYPE"
        ],
        "type": "geojson"
    }
}