{
    "coverage": {
        "US Census": {
            "geoid": "51009",
            "name": "Amherst County",
            "state": "Virginia"
        },
        "country": "us",
        "state": "va",
        "county": "Amherst"
    },
    "data": "http://vcloud.timmons.com/ArcGIS/rest/services/Amherst/Amherst_Weblogistics/MapServer/1",
    "type": "ESRI",
    "website": "http://amherstgis.timmons.com/",
    "conform": {
        "lon": "x",
        "lat": "y",
        "number": "address",
        "street": "roadname",
        "type": "geojson"
    }
}