{
    "coverage": {
        "US Census": {"geoid": "37127", "name": "Nash County", "state": "North Carolina"},
        "country": "us",
        "state": "nc",
        "county": "Nash"
    },
    "data": "http://data.nconemap.gov/downloads/vector/parcels/Nash_parcels_2017_09_19.zip",
    "type": "http",
    "compression": "zip",
    "website": "http://data.nconemap.gov/geoportal/catalog/search/resource/details.page?uuid=%7B837C5704-49C8-45A3-B084-AEBF4CD09804%7D",
    "conform": {
        "type": "shapefile",
        "file": "nc_nash_parcels_pt_2017_09_19.shp",
        "id": "PARNO",
        "number": {
            "function": "prefixed_number",
            "field": "SITEADD"
        },
        "street": {
            "function": "postfixed_street",
            "field": "SITEADD"
        }
    }
}
