{
    "website": "http://busca.datos.gob.mx/#/conjuntos/directorio-estadistico-nacional-de-unidades-economicas-denue-por-entidad-federativa",
    "conform": {
        "city": "Municipio",
        "street": "Nombre de la vialidad",
        "region": "Puebla",
        "lon": "Longitud",
        "number": "Número exterior o kilómetro",
        "postcode": "Código Postal",
        "lat": "Latitud",
        "type": "csv"
    },
    "attribution": "Source: INEGI, Directorio Estadístico Nacional de Unidades Económicas (DENUE)",
    "compression": "zip",
    "license": {
        "url": "http://datos.gob.mx/libreusomx/",
        "attribution": true,
        "share-alike": false
    },
    "data": "http://www3.inegi.org.mx/sistemas/descarga/descargaarchivo.aspx?file=DENUE%2fEntidad_federativa%2f21_Puebla%2fdenue_21_25022015_csv.zip",
    "coverage": {
        "ISO 3166": {
            "alpha2": "MX-PUE",
            "country": "Mexico",
            "state": "Puebla"
        },
        "country": "mx"
    },
    "type": "http"
}