{
    "coverage": {
        "US Census": {
            "geoid": "39145",
            "name": "Scioto County",
            "state": "Ohio"
        },
        "country": "us",
        "state": "oh",
        "county": "Scioto"
    },
    "data": "https://www.sciotocountyengineer.org/arcgis/rest/services/OneView/ParcelsSearch/MapServer/0/1",
    "type": "ESRI",
    "conform": {
        "type": "geojson",
        "number": "LocStrNo",
        "street": [
            "LocStrDir",
            "LocStrName",
            "LocStrSuffix"
        ],
        "unit": "LocStrNo2",
        "city": "LocCity",
        "region": "LocState",
        "postcode": "LocZipCode"
    }
}
