{
  "coverage": {
    "US Census": {
      "geoid": "30063",
      "name": "Missoula County",
      "state": "Montana"
    },
    "country": "us",
    "state": "mt",
    "county": "Missoula"
  },
  "data": "ftp://anonymous:anonymous@ftp.gis.mt.gov/CadastralFramework/Missoula/MissoulaOwnerParcel_shp.zip",
  "type": "ftp",
  "compression": "zip",
  "conform": {
    "number": {
      "function": "regexp",
      "field": "AddressLin",
      "pattern": "^([0-9]+)"
    },
    "street": {
      "function": "regexp",
      "field": "AddressLin",
      "pattern": "^(?:[0-9]+ )(.*)",
      "replace": "$1"
    },
    "type": "shapefile-polygon",
    "accuracy": 2
  }
}