{
    "coverage": {
        "country": "ca",
        "state": "ab",
        "city": "Red Deer",
        "geometry": {
            "type": "Point",
            "coordinates": [
                -113.802,
                52.26682
            ]
        }
    },
    "data": "http://maps.rdcounty.ca:6080/arcgis/rest/services/RDC_ArcGIS_Base_Map/MapServer/8",
    "type": "ESRI",
    "conform": {
        "type": "geojson",
        "number": "HOUSE_ID",
        "street": [
            "DIR_PREF",
            "NAME_PREF",
            "MAIN_NAME",
            "ROAD_TYPE",
            "DIR_SUFX"
        ],
        "unit": "UNIT_NUM"
    }
}
