{
    "coverage": {
        "US Census": {
            "geoid": "17097",
            "name": "Lake County",
            "state": "Illinois"
        },
        "country": "us",
        "state": "il",
        "county": "Lake"
    },
    "data": "http://rest.lakecountyil.gov/ArcGIS/rest/services/TaxPortalBaseMap/MapServer/41",
    "type": "ESRI",
    "skip": true,
    "note": "times out"
}